{"authorities":[{"atom":{"atom_id":"semantic-atom:4ae6763671ea869ec28da48d840aa324178d16aef0a08eb8ee2888d0290a665e","audit_context_sha256":"54c9807aeba44ad48853db97b48f2f3f59b1dfcffd8cd55e199378b59786f01d","evidence_world_sha256":"e368929d13822e40d14283c80e89d82239601abf77e40ff60c455834ddc8acde","fields":{"left_object":"dossier","left_polarity":"positive","left_predicate":"review","left_subject":"alice","right_object":"dossier","right_polarity":"positive","right_predicate":"archive","right_subject":"bob","temporal_relation":"BEFORE"},"measurement_receipt_id":"measurement:f0289997e70f63b11b5e141210367fd81a3dd77a0563f5699a760f1538f9a7c9","passage_id":"passage:cdfce7346d70aaa440927df2a1467e3d","semantic_family":"direct_event_order","source_id":"S-C2-SUPPORT"},"audit_context_sha256":"54c9807aeba44ad48853db97b48f2f3f59b1dfcffd8cd55e199378b59786f01d","authority_id":"semantic-authority:c1758e9ca3d6a47d6fcb3643caa5252bb25da0555342208a025ed83bed462036","evidence_world_sha256":"e368929d13822e40d14283c80e89d82239601abf77e40ff60c455834ddc8acde","reason":"ALL_REQUIRED_WARRANT_ESTABLISHED","status":"WARRANTED"}],"authorization":{"automatic_action_allowed":false,"state":"not_evaluated"},"composition":{"audit_context_sha256":"54c9807aeba44ad48853db97b48f2f3f59b1dfcffd8cd55e199378b59786f01d","conclusion":"contradicted","deciding_relation_ids":["bound-relation:0fb7ba0d3f1ef3f8fa70534675df2345b11d98b1e5c167b921d4bb8208781dc7"],"evidence_world_sha256":"e368929d13822e40d14283c80e89d82239601abf77e40ff60c455834ddc8acde","failure_code":null,"non_deciding_relation_ids":[],"precedence":["UNRESOLVED","SUPPORT_REFUTE_CONFLICT","SUPPORTS","REFUTES","NO_DECIDING_RELATION"],"proposition_sha256":"d8b28994e045cd8a48fcc6710c5a9425fa88c3aa58892006d8d455f58096990d","relation_categories":["REFUTES"],"relation_ids":["bound-relation:0fb7ba0d3f1ef3f8fa70534675df2345b11d98b1e5c167b921d4bb8208781dc7"],"rule_id":"scoreless-categorical-v1"},"contract_c_handoff":{"owner":"apparatus-contracts","reason":"separate_compose_only_versioned_handoff_layer","state":"not_emitted"},"distribution_version":"0.6.0","evidence_world":{"admitted_passage_ids":["passage:cdfce7346d70aaa440927df2a1467e3d"],"aperture_observation":{"contract_b_factual_context_state":"present","observation":{"claim_id":"C2","limitations":["B1.2 lacks native admission_state=not_applicable; non-retained candidates use review.decision=needs-review only as compatibility encoding while preserving native_admission_state=not_applicable.","Candidate depth is bounded and does not establish corpus completeness.","No support, refutation, applicability, completeness or verdict is emitted.","Nomination, retention and admission are distinct non-semantic stages."],"outcome":{"state":"known","value":{"accepted_count":1,"aperture_state":"bounded_under_limit","candidate_depth_hit":false,"needs_review_count":2,"not_retained_count":0,"rejected_count":0,"retained_count":3,"returned_count":3,"status":"completed"}},"search_scope":{"candidate_depth_limit":10,"config_sha256":"sha256:5b10d0c29794e80d6876a99e26bcf6ec6a27a4c5165aee78054a6bc32759f4bc","query_id":"query:5747a15d23f15b2208c632eda525cb4f","requested_source_ids":["S-C1-REFUTE","S-C1-SUPPORT","S-C2-SUPPORT","S-D01","S-D02","S-D03","S-D04","S-D05","S-D06","S-D07"],"retained_k":3,"retrieval_id":"retrieval:27ed82ed47707df2d3b460b1cc0fd414","retrieval_lane":"declared_child","searched_source_ids":["S-C1-REFUTE","S-C1-SUPPORT","S-C2-SUPPORT","S-D01","S-D02","S-D03","S-D04","S-D05","S-D06","S-D07"]}}},"audit_context_sha256":"54c9807aeba44ad48853db97b48f2f3f59b1dfcffd8cd55e199378b59786f01d","available_but_unused_passage_ids":[],"bundle_hash":"sha256:c7be5440f4da6d3b3560848bc04025bcf45e45783f0925501d3a844f70f939cb","bundle_id":"d2915bdc-bd20-5f6f-8f6f-f06ddc1a8f7b","contract_b_version":"1.2.0","evidence_world_sha256":"e368929d13822e40d14283c80e89d82239601abf77e40ff60c455834ddc8acde"},"input":{"audit_context_artifact_sha256":"sha256:afc612a100c030c0929d1f51f6ab36570db0ea43a235c1de168798b5c424045a","contract_b":{"bundle_hash":"sha256:c7be5440f4da6d3b3560848bc04025bcf45e45783f0925501d3a844f70f939cb","bundle_id":"d2915bdc-bd20-5f6f-8f6f-f06ddc1a8f7b","extension_state":"present","intake_snapshot_sha256":"sha256:5c6940f932f152b3d2b670d376ed28d3328ea5282ca3ab461e5e87e7bc606d4a","version":"1.2.0"},"input_schema_sha256":"sha256:875f0a320699743befd3f61ea41b8f9ef86a520ac7edd4ef07b502b0d3a93798","mode":"contract_b_bundle","primary_input_sha256":"sha256:cff8d80112af2a0b6cc50fd727c01bd88a84808c33efe875401711b67bafca40"},"measurements":[{"audit_context_sha256":"54c9807aeba44ad48853db97b48f2f3f59b1dfcffd8cd55e199378b59786f01d","available_passage_ids":["passage:cdfce7346d70aaa440927df2a1467e3d"],"consumed_passage_ids":["passage:cdfce7346d70aaa440927df2a1467e3d"],"consumed_spans":[{"end":51,"passage_id":"passage:cdfce7346d70aaa440927df2a1467e3d","start":0}],"diagnostics":{},"instrument_id":"rc7fc-event-order","instrument_version":"rc7fc-event-order-1","observed_semantic_spans":[{"end":29,"role":"temporal_cue","start":23}],"raw_measurement":{"proposals":[{"left_event":{"object":"dossier","polarity":"positive","predicate":"review","subject":"alice"},"relation":"BEFORE","right_event":{"object":"dossier","polarity":"positive","predicate":"archive","subject":"bob"},"span":[23,29]}],"status":"CLAIMED"},"receipt_id":"measurement:f0289997e70f63b11b5e141210367fd81a3dd77a0563f5699a760f1538f9a7c9","semantic_family":"direct_event_order"}],"original_claim":"Alice reviewed dossier before Bob archived dossier.","profile":"cal-v1-integration-candidate-v1","proposition":{"fields":{"left_object":"dossier","left_polarity":"positive","left_predicate":"review","left_subject":"alice","right_object":"dossier","right_polarity":"positive","right_predicate":"archive","right_subject":"bob","temporal_relation":"AFTER"},"proposition_id":"C2","proposition_sha256":"d8b28994e045cd8a48fcc6710c5a9425fa88c3aa58892006d8d455f58096990d","semantic_family":"direct_event_order","text_sha256":"fafacbe46796663d673cdcbf3e53860e50cad3e9dd4566dc47ac116b5b4e309f"},"relations":[{"audit_context_sha256":"54c9807aeba44ad48853db97b48f2f3f59b1dfcffd8cd55e199378b59786f01d","authority_id":"semantic-authority:c1758e9ca3d6a47d6fcb3643caa5252bb25da0555342208a025ed83bed462036","categorical_relation":"REFUTES","evidence_world_sha256":"e368929d13822e40d14283c80e89d82239601abf77e40ff60c455834ddc8acde","passage_id":"passage:cdfce7346d70aaa440927df2a1467e3d","proposition_sha256":"d8b28994e045cd8a48fcc6710c5a9425fa88c3aa58892006d8d455f58096990d","relation_id":"bound-relation:0fb7ba0d3f1ef3f8fa70534675df2345b11d98b1e5c167b921d4bb8208781dc7"}],"result":{"conclusion":"contradicted","deciding_passage_ids":["passage:cdfce7346d70aaa440927df2a1467e3d"],"failure_code":null,"non_deciding_passage_ids":[],"traces":[{"authority":{"atom":{"atom_id":"semantic-atom:4ae6763671ea869ec28da48d840aa324178d16aef0a08eb8ee2888d0290a665e","audit_context_sha256":"54c9807aeba44ad48853db97b48f2f3f59b1dfcffd8cd55e199378b59786f01d","evidence_world_sha256":"e368929d13822e40d14283c80e89d82239601abf77e40ff60c455834ddc8acde","fields":{"left_object":"dossier","left_polarity":"positive","left_predicate":"review","left_subject":"alice","right_object":"dossier","right_polarity":"positive","right_predicate":"archive","right_subject":"bob","temporal_relation":"BEFORE"},"measurement_receipt_id":"measurement:f0289997e70f63b11b5e141210367fd81a3dd77a0563f5699a760f1538f9a7c9","passage_id":"passage:cdfce7346d70aaa440927df2a1467e3d","semantic_family":"direct_event_order","source_id":"S-C2-SUPPORT"},"audit_context_sha256":"54c9807aeba44ad48853db97b48f2f3f59b1dfcffd8cd55e199378b59786f01d","authority_id":"semantic-authority:c1758e9ca3d6a47d6fcb3643caa5252bb25da0555342208a025ed83bed462036","evidence_world_sha256":"e368929d13822e40d14283c80e89d82239601abf77e40ff60c455834ddc8acde","reason":"ALL_REQUIRED_WARRANT_ESTABLISHED","status":"WARRANTED"},"detail":null,"failure_code":null,"measurement":{"audit_context_sha256":"54c9807aeba44ad48853db97b48f2f3f59b1dfcffd8cd55e199378b59786f01d","available_passage_ids":["passage:cdfce7346d70aaa440927df2a1467e3d"],"consumed_passage_ids":["passage:cdfce7346d70aaa440927df2a1467e3d"],"consumed_spans":[{"end":51,"passage_id":"passage:cdfce7346d70aaa440927df2a1467e3d","start":0}],"diagnostics":{},"instrument_id":"rc7fc-event-order","instrument_version":"rc7fc-event-order-1","observed_semantic_spans":[{"end":29,"role":"temporal_cue","start":23}],"raw_measurement":{"proposals":[{"left_event":{"object":"dossier","polarity":"positive","predicate":"review","subject":"alice"},"relation":"BEFORE","right_event":{"object":"dossier","polarity":"positive","predicate":"archive","subject":"bob"},"span":[23,29]}],"status":"CLAIMED"},"receipt_id":"measurement:f0289997e70f63b11b5e141210367fd81a3dd77a0563f5699a760f1538f9a7c9","semantic_family":"direct_event_order"},"passage_id":"passage:cdfce7346d70aaa440927df2a1467e3d","relation":{"audit_context_sha256":"54c9807aeba44ad48853db97b48f2f3f59b1dfcffd8cd55e199378b59786f01d","authority_id":"semantic-authority:c1758e9ca3d6a47d6fcb3643caa5252bb25da0555342208a025ed83bed462036","categorical_relation":"REFUTES","evidence_world_sha256":"e368929d13822e40d14283c80e89d82239601abf77e40ff60c455834ddc8acde","passage_id":"passage:cdfce7346d70aaa440927df2a1467e3d","proposition_sha256":"d8b28994e045cd8a48fcc6710c5a9425fa88c3aa58892006d8d455f58096990d","relation_id":"bound-relation:0fb7ba0d3f1ef3f8fa70534675df2345b11d98b1e5c167b921d4bb8208781dc7"}}]},"schema":"cal-v1-result-v2","semantic_implementation_sha":"847cc970642bb648dc994b929c2053b5c9d4648c"}
